title,link,image,board_id
"Invisible Sleep Headphones,Sleep Earbuds for Side Sleepers,Small Comfortable Noise Blocking Sleep Ea",https://www.amazon.com/dp/B0H1KRY82C?tag=francisiwajoh-20,https://m.media-amazon.com/images/I/61fPIpJGoSL.jpg,1118440957400875198
"kurdene Wireless Earbuds 5.4 Bluetooth Headphones, Open Ear Buds with Deep Bass Sound, 60Hrs Playtim",https://www.amazon.com/dp/B0H3NYD283?tag=francisiwajoh-20,https://m.media-amazon.com/images/I/61gwop+UtPL.jpg,1118440957400875190
"P5 Wall Mount Kit Cooling Station with Dual Controller Charger, Floating Shelf Behind TV for P5/Slim",https://www.amazon.com/dp/B0H25VJH68?tag=francisiwajoh-20,https://m.media-amazon.com/images/I/71gC4bNOTWL.jpg,1118440957400875203
"500 PCS Index Card Laminating Pouches, 3x5 File Card Laminating Sheets, 5mil PET Thermal Laminating ",https://www.amazon.com/dp/B0GZTXDZ5K?tag=francisiwajoh-20,https://m.media-amazon.com/images/I/71e5u2ZFLlL.jpg,1118440957400875197
"TOYOUTHS Celtic Bracelet Compatible with Apple Watch Bands 38/40/41/42/44/45/46/49mm Women, Dressy C",https://www.amazon.com/dp/B0GLQDHK25?tag=francisiwajoh-20,https://m.media-amazon.com/images/I/71n3uCsXKwL.jpg,1118440957400875190
"604K50471 Fuser Unit 110V for Xerox Phaser 4510 | Replaces 126K23786, 604K57440, 604K37338, 604K3733",https://www.amazon.com/dp/B0H5QYQ6WT?tag=francisiwajoh-20,https://m.media-amazon.com/images/I/61oCUihSceL.jpg,1118440957400875197
"SHOKZ OpenDots ONE-Open-Ear Headphones, Clip-On Earbuds-Wireless Bluetooth Earbuds with Microphone-S",https://www.amazon.com/dp/B0GFH2T5K2?tag=francisiwajoh-20,https://m.media-amazon.com/images/I/61FCn4sj3dL.jpg,1118440957400875194
