title,link,image,board_id
Aulumu G05 Pro Magnetic Kickstand Multifunctional EDC Tool | Rotation Angle Adjustment | Ultra Light,https://www.amazon.com/dp/B0H1R6WSZK?tag=francisiwajoh-20,https://m.media-amazon.com/images/I/61bn46U02sL.jpg,1118440957400875198
962XL Ink Cartridges Combo Pack Compatible Replacement for HP 962XL 962 Ink Cartridges to Use with H,https://www.amazon.com/dp/B0GY823VH5?tag=francisiwajoh-20,https://m.media-amazon.com/images/I/71AJTe7uhSL.jpg,1118440957400875198
"Redragon S168 3-Mode Wilreess Gaming Keyboard & Mouse Combo, 81 Keys K673 PRO RGB Gasket Keyboard an",https://www.amazon.com/dp/B0GWPPNQJW?tag=francisiwajoh-20,https://m.media-amazon.com/images/I/61a1aZ5thrL.jpg,1118440957400875203
"Compatible with JASP Keyboard Joystick Compatible with PC Gamers and One-Handed Users, Solves WASD M",https://www.amazon.com/dp/B0GZV8KHGC?tag=francisiwajoh-20,https://m.media-amazon.com/images/I/51VR0a8BKVL.jpg,1118440957400875203
HORI Wireless HORIPAD Turbo (Kirby & Waddle Dee) for Nintendo Switch 2 - Wireless Handheld Controlle,https://www.amazon.com/dp/B0GZT27G5W?tag=francisiwajoh-20,https://m.media-amazon.com/images/I/61TecUpxwlL.jpg,1118440957400875203
HORI Vault Case (Kirby & Waddle Dee) for Nintendo Switch 2 - Hard Shell Carrying Case for Switch 2 -,https://www.amazon.com/dp/B0GZSJLZ41?tag=francisiwajoh-20,https://m.media-amazon.com/images/I/61AF1caM9DL.jpg,1118440957400875203
"BICUUZHI Sports Game Soccer Carrying Case Bag for Gaming Console, Waterproof Travel Crossbody Sling ",https://www.amazon.com/dp/B0GZV98Q92?tag=francisiwajoh-20,https://m.media-amazon.com/images/I/71-m79vGZWL.jpg,1118440957400875203
