title,link,image,board_id
"Rongta Bluetooth Label Maker Machine, Thermal Label Printer Easy to Use for Office, Home, Business, ",https://www.amazon.com/dp/B0GJTX57BT?tag=francisiwajoh-20,https://m.media-amazon.com/images/I/71qFfgdEwdL.jpg,1118440957400875181
"Switch 2 Dock with Integrated 6FT HDMI 2.1 Cable, 4K@120Hz Portable USB C TV Docking Station for Nin",https://www.amazon.com/dp/B0GL16QMZ7?tag=francisiwajoh-20,https://m.media-amazon.com/images/I/71RhmxmqLBL.jpg,1118440957400875181
WMARK Compressed Air Duster Rechargeable Cordless-130000RPM Brushless Motor Stepless Control Handhel,https://www.amazon.com/dp/B0GT78QX7J?tag=francisiwajoh-20,https://m.media-amazon.com/images/I/61pyl2+gLWL.jpg,1118440957400875181
"JanSport Cool Backpack with 15-inch Laptop Sleeve, Large Computer Bag Rucksack with 2 Compartments, ",https://www.amazon.com/dp/B0FLF7G4TS?tag=francisiwajoh-20,https://m.media-amazon.com/images/I/81-GN-tLFML.jpg,1118440957400875181
Personalized 250th Anniversary Banner 250th Anniversary Flag Celebration - Custom Family Name for Fa,https://www.amazon.com/dp/B0GWTRK9HQ?tag=francisiwajoh-20,https://m.media-amazon.com/images/I/91qvnNF8tjL.jpg,1118440957400875187
Congrats Grad Backdrop Graduation Crawfish Boil Lemon Class of 2026 Graduate Party Photography Backg,https://www.amazon.com/dp/B0GSGL4YC7?tag=francisiwajoh-20,https://m.media-amazon.com/images/I/81qb8QmJcVL.jpg,1118440957400875187
Big Black Bow Backdrop Party Decorations Black Bow Decor 48x24x120 Inches Giant Bow Birthday Party B,https://www.amazon.com/dp/B0GC6R78VS?tag=francisiwajoh-20,https://m.media-amazon.com/images/I/81fpdlx2u0L.jpg,1118440957400875187
Big White Bow Backdrop Party Decorations White Bow Decor 48x24x120 Inches Giant Bow Birthday Party B,https://www.amazon.com/dp/B0GC7K82X1?tag=francisiwajoh-20,https://m.media-amazon.com/images/I/81X1fA3dl3L.jpg,1118440957400875187
K-Style Purple Foil Fringe Curtains Party Decorations - 2 Pack 3.3 ft x 6.6 ft Energy Pattern Foil P,https://www.amazon.com/dp/B0GVXGX9SB?tag=francisiwajoh-20,https://m.media-amazon.com/images/I/81bga+HY5rL.jpg,1118440957400875187
"sharge Mini Portable Charger 45W 10000mAh Power Bank, Fast Charging Battery Pack with Built-in USB-C",https://www.amazon.com/dp/B0GGRHP4KY?tag=francisiwajoh-20,https://m.media-amazon.com/images/I/51taAe10eiL.jpg,1118440957400875190
"Insta360 Snap Selfie Screen with Light - 4K Magnetic Selfie Monitor Screen for Selfie, Vlogging, Com",https://www.amazon.com/dp/B0G92M6VFM?tag=francisiwajoh-20,https://m.media-amazon.com/images/I/51F4GtzXlkL.jpg,1118440957400875190
Ripeng 20 Pcs Teacher Appreciation Gifts Bulk Bamboo Phone Stand for Desk Office Workers Thank You B,https://www.amazon.com/dp/B0GKDVF77F?tag=francisiwajoh-20,https://m.media-amazon.com/images/I/81GXTRFW6KL.jpg,1118440957400875190
"JoySpark Kids Bluetooth Headphones, 60 Hours Playtime, Bluetooth 5.4 Kids Headphones Wireless, Type-",https://www.amazon.com/dp/B0GT4HS7H5?tag=francisiwajoh-20,https://m.media-amazon.com/images/I/61+421qhc6L.jpg,1118440957400875190
"Front Privacy Screen Protector for Nothing Phone (4a) Pro,Anti-Spy Tempered Glass Film,Anti-scratch,",https://www.amazon.com/dp/B0GSVQ1WVD?tag=francisiwajoh-20,https://m.media-amazon.com/images/I/61nu8KUWhIL.jpg,1118440957400875190
Waterproof Underwater Swim Headphones with Transmitter + Bone Conduction Receiver – Stream Spotify/A,https://www.amazon.com/dp/B0GXZCQT47?tag=francisiwajoh-20,https://m.media-amazon.com/images/I/71sAOhLLdWL.jpg,1118440957400875194
"Sleep Earbuds Bluetooth 6.0 in Ear, 2026 New Mini Sleep Headphones with Sleep Monitor and APP, Sleep",https://www.amazon.com/dp/B0GXYZTWXK?tag=francisiwajoh-20,https://m.media-amazon.com/images/I/612uCiwUtkL.jpg,1118440957400875194
"bmani Ear Buds Wireless Earbuds Bluetooth Headphones with 80H Playtime LED Display Case, Over-Ear Ho",https://www.amazon.com/dp/B0GXFRMV6H?tag=francisiwajoh-20,https://m.media-amazon.com/images/I/71X1Vc38WVL.jpg,1118440957400875194
"Adorable Frog Wireless Bluetooth Earbuds, Unique 3D Animal Shaped Headphones with Charging Case, Cut",https://www.amazon.com/dp/B0GXZJCKT9?tag=francisiwajoh-20,https://m.media-amazon.com/images/I/61jDDd-NHbL.jpg,1118440957400875194
"Soundcore Space 2 by Anker, Active Noise Cancelling Headphones with Protective Case, Comfortable Fit",https://www.amazon.com/dp/B0GXZTXMYG?tag=francisiwajoh-20,https://m.media-amazon.com/images/I/71EhAz8tSkL.jpg,1118440957400875194
"[Android 14 & 800ANSI] Magcubic Mini Projector 4K 8K Support, Smart Projector Native 1080P with WiFi",https://www.amazon.com/dp/B0G64GMYH9?tag=francisiwajoh-20,https://m.media-amazon.com/images/I/7130HfKQmyL.jpg,1118440957400875197
071H 071 Toner Cartridge Replacement for Canon 071 Black Toner Cartridge Work with Canon ImageCLASS ,https://www.amazon.com/dp/B0GVBZQYV7?tag=francisiwajoh-20,https://m.media-amazon.com/images/I/718m5g2QXdL.jpg,1118440957400875197
31 32XL Refill Ink Bottle Set For HP 31 32XL Ink Bottle Set Compatible For HP Smart Tank 7600 7602 7,https://www.amazon.com/dp/B0GWHGQQ6R?tag=francisiwajoh-20,https://m.media-amazon.com/images/I/71KBSy9WAhL.jpg,1118440957400875197
31 32XL Refill Ink Bottle Set For Hp 31 32XL Ink Bottle Set Compatible For Hp Smart Tank 7600 7602 7,https://www.amazon.com/dp/B0GWHGQ9SH?tag=francisiwajoh-20,https://m.media-amazon.com/images/I/71QZTAw5pxL.jpg,1118440957400875197
31 32XL Refill Ink Bottle Set For Hp 31 32XL Ink Bottle Set Compatible For Hp Smart Tank 7600 7602 7,https://www.amazon.com/dp/B0GWHFY78J?tag=francisiwajoh-20,https://m.media-amazon.com/images/I/71dn9fyBzVL.jpg,1118440957400875197
"Bose SoundLink Micro Portable Bluetooth Speaker (2nd Gen), Wireless Outdoor Speaker, Up to 12 Hours ",https://www.amazon.com/dp/B0GL973JZN?tag=francisiwajoh-20,https://m.media-amazon.com/images/I/617fHF7FU4L.jpg,1118440957400875198
"Bose SoundLink Flex Bluetooth Speaker (2nd Gen) - Portable Outdoor Speaker with Hi-Fi Audio, Waterpr",https://www.amazon.com/dp/B0GL88K2QX?tag=francisiwajoh-20,https://m.media-amazon.com/images/I/61JzDMJom5L.jpg,1118440957400875198
"2026 Upgraded Vacuum Suction Phone Mount for Magsafe [109+LBS Strongest Suction], 360° Adjustable Fo",https://www.amazon.com/dp/B0GWLMRWVW?tag=francisiwajoh-20,https://m.media-amazon.com/images/I/71vJ1WwdaHL.jpg,1118440957400875198
"UGREEN 25W Magnetic Wireless Charger Stand, Qi2.2 Certified MagSafe Compatible 2 in 1 Charging Stati",https://www.amazon.com/dp/B0FXGSDNL4?tag=francisiwajoh-20,https://m.media-amazon.com/images/I/51Pmof9F16L.jpg,1118440957400875198
Chumia 5.9 x 5.9 ft Large Happy Father's Day Backdrop Chalkboard Photography Background Father's Par,https://www.amazon.com/dp/B0GH1H27KZ?tag=francisiwajoh-20,https://m.media-amazon.com/images/I/81pQNnEDRwL.jpg,1118440957400875198
"TPU Protective Case Compatible with Anbernic RG 476H, for Transparent Display, Anti-Scratch and Enha",https://www.amazon.com/dp/B0GSZL4C48?tag=francisiwajoh-20,https://m.media-amazon.com/images/I/71S41TvlANL.jpg,1118440957400875203
"RK ROYAL KLUDGE X104 Full Size Mechanical Keyboard, Wired Creamy Gaming Keyboard with Number Pad and",https://www.amazon.com/dp/B0GL2FG2WW?tag=francisiwajoh-20,https://m.media-amazon.com/images/I/610rnLdp-bL.jpg,1118440957400875203
"Bluetooth Mouse Wireless, Rechargeable,7 Buttons, Silent Click, Ergonomic, 7-Color Backlit, Multi-De",https://www.amazon.com/dp/B0GL59NF9P?tag=francisiwajoh-20,https://m.media-amazon.com/images/I/61yPZp3TX3L.jpg,1118440957400875203
"iPad Pencil for Apple iPad 2018–2026, Magnetic Charging Stylus Pen for Pencil 2nd Generation &1st Ge",https://www.amazon.com/dp/B0GLDN85ZG?tag=francisiwajoh-20,https://m.media-amazon.com/images/I/41dlsNtGXtL.jpg,1118440957400875203
"Wireless Gaming Headset for PS5, PS4, Switch, PC, Mac, Ultra-Low Latency 2.4GHz Dongle & Bluetooth 5",https://www.amazon.com/dp/B0GQ8WHWMF?tag=francisiwajoh-20,https://m.media-amazon.com/images/I/71arLZBt+sL.jpg,1118440957400875203
