title,link,image,board_id
"PS5 Controller Charger with Fast Charging,Docking Station Replacement for PS 5 Accessories Kits with",https://www.amazon.com/dp/B0H2LYFZ5D?tag=francisiwajoh-20,https://m.media-amazon.com/images/I/61Q6M8eVRDL.jpg,1118440957400875203
"Linsoul TANGZU Wan'er S.G II in Ear Monitor,HiFi Wired Earbuds,10mm Dynamic Driver PET Diaphragm Gam",https://www.amazon.com/dp/B0GJS56WL5?tag=francisiwajoh-20,https://m.media-amazon.com/images/I/614TqzWJHiL.jpg,1118440957400875194
"20ft x 10ft Red Royal Blue Sequin Backdrop Curtain for Parties, Wrinkle Free Glitter Photo Backdrop ",https://www.amazon.com/dp/B0GVN96DV7?tag=francisiwajoh-20,https://m.media-amazon.com/images/I/81CPfiYfXwL.jpg,1118440957400875187
LCL 125 Black Toner Cartridge Replacement for Canon 125 CRG125 ImageClass LBP6000 LBP6000B LBP6018 L,https://www.amazon.com/dp/B0GZPBJFSF?tag=francisiwajoh-20,https://m.media-amazon.com/images/I/71EeIVkfEbL.jpg,1118440957400875197
"3D VR Headset, Virtual Reality Glasses Headset Helmets, Compatible with 5.0-7.0 inch with Controller",https://www.amazon.com/dp/B0GT4QXJMQ?tag=francisiwajoh-20,https://m.media-amazon.com/images/I/61g4XNEBKeL.jpg,1118440957400875190
